{"comparison_id":"EQA-CMP-EXAMPLE-001","issue_key":"TE:p12:heading:level","source_report_ids":["TE-RUN-EXAMPLE","PPR-RUN-EXAMPLE"],"comparison_state":"partial_agreement","severity_basis":"same object, different scope","intervention":"escalate","route":"TE owner","preserved_disagreement":true,"adjudication_id":null}
